{"schema_version":"1.0","scenario_id":"f02-worker-exhaustion-repaired","pair_id":"F02","variant":"repaired","runtime":"java","seed":1502,"workload":{"requests":20,"children_per_request":4,"payload_bytes":262144,"child_delay_ms":30},"limits":{"deadline_ms":500,"max_requests":16,"max_children":64,"memory_bytes":536870912,"cleanup_grace_ms":200},"fault":"worker_exhaustion","controls":{"partition_cpu_work":true,"bounded_admission":true,"joined_task_scope":true,"bounded_buffers":true,"gc_observation":true,"synchronized_state":true,"propagate_cancellation":true,"lexical_resource_scope":true,"runtime_validation":true},"expected":{"target_invariant":"I02"}}
