{"schema_version":"1.0","scenario_id":"f04-allocation-pressure-repaired","pair_id":"F04","variant":"repaired","runtime":"rust","seed":1504,"workload":{"requests":20,"children_per_request":4,"payload_bytes":262144,"child_delay_ms":30},"limits":{"deadline_ms":500,"max_requests":16,"max_children":64,"memory_bytes":536870912,"cleanup_grace_ms":200},"fault":"allocation_pressure","controls":{"partition_cpu_work":true,"bounded_admission":true,"joined_task_scope":true,"bounded_buffers":true,"gc_observation":true,"synchronized_state":true,"propagate_cancellation":true,"lexical_resource_scope":true,"runtime_validation":true},"expected":{"target_invariant":"I08"}}
